Source,Title,Date,Author,URL,Summary,Content,Image_URLs
TechCrunch,Meta reportedly considering layoffs that could affect 20% of the company,"Sat, 14 Mar 2026 16:28:42 +0000",Anthony Ha,https://techcrunch.com/2026/03/14/meta-reportedly-considering-layoffs-that-could-affect-20-of-the-company/,"Meta is considering layoffs of over 20% of its nearly 79,000 employees to offset AI-related spending and acquisitions. The company called reports “speculative,” amid industry-wide layoffs influenced by AI automation. Previous large-scale layoffs occurred in 2022 and early 2023.","Meta is considering major layoffs that could affect 20% or more of the company’s workforce, according to Reuters. These layoffs could help the Facebook parent company offset its aggressive spending on AI infrastructure, as well as AI-related acquisitions and hiring. Meta employed nearly 79,000 people as of December 31, according to a recent filing.

A Meta spokesperson described the report as “speculative reporting about theoretical approaches.” The news comes amid widespread layoffs in the tech industry, with companies like Block announcing significant cuts, citing AI automation as a factor. Some experts and executives, including OpenAI’s Sam Altman, have suggested that many of these layoffs may be “AI-washing,” where AI is used as a cover for other issues such as over-hiring during the pandemic.

The last time Meta announced layoffs of this scale was in November 2022, when it cut 11,000 jobs, followed by another 10,000 in March 2023.",docs/images/techcrunch_3_1773522573529.jpg
Polygon,Teenage Mutant Ninja Turtles II: Secret of the Ooze is still the most fun to be had in a TMNT movie,"Sat, 14 Mar 2026 17:00:18 GMT",Brian VanHooker,https://www.polygon.com/teenage-mutant-ninja-turtles-ii-secret-of-the-ooze-35th-anniversary/,"To celebrate its 35th anniversary, the 1991 film Teenage Mutant Ninja Turtles II: The Secret of the Ooze was re-released in theaters, initially for two days, then extended due to strong presales and box office success, earning $3.3 million. The film features a lighter, humorous tone with the Turtles fighting with playful weapons, and a sequel release is planned for next year.","Last August, the shellbacks made a very unexpected comeback. For the 35th anniversary of the original Teenage Mutant Ninja Turtles film, Fathom and Saga Arts rereleased the superhero action-comedy in theaters. Originally, the event was supposed to run just two days, but ticket presales were so promising they extended it to a whole week and expanded the number of theaters. Then, after the film earned a surprising $3.3 million at the box office, the event was extended another week and Fathom announced that its sequel would get a similar release next year.

Now, 1991’s Teenage Mutant Ninja Turtles II: The Secret of the Ooze is back in theaters, and, 35 years later, it’s still the most fun to be had with the Turtles on film, especially for those who grew up in the original Turtle-Mania of the late 1980s and early 1990s.

Teenage Mutant Ninja Turtles II: The Secret of the Ooze takes place soon after the heroes defeat Shredder at the end of the first film. While they’re unable to return to their sewer home because it has been discovered by the Foot Clan, the brothers stay at the apartment of their human friend April O’Neil until they find a new place, which they eventually do in an old abandoned subway station. The Shredder, however, is not dead and begins rebuilding the Foot Clan. Worse, he creates two monstrous new mutants to get revenge on the Turtles.

Despite being a revenge story, it’s worth noting that Secret of the Ooze was much lighter in tone than its predecessor. The 1990 film mostly adapted the original, grittier comic books, and lightened them with humor from the 1987 cartoon series. The result was a story filled with action, drama, humor, and heart, but it was also violent enough to draw complaints from parenting groups. As a result, Secret of the Ooze adopted a far lighter tone; the Turtles constantly crack jokes and take almost nothing seriously. They also rarely use their ninja weapons. Yet these changes didn’t break the Turtle formula—other, worse Turtle films would do that later—or make Secret of the Ooze a so-bad-it’s-good movie. Instead, screenwriter Todd Langen, who also wrote the original, embraced this new direction and made the most of it, which is why many Turtle fans still love this sequel.

Secret of the Ooze opens with the Turtles beating up a band of burglars in a shopping mall. The tone shift is immediately apparent. Instead of attacking with swords and nunchucks, the Turtles fight with yo-yos and foam baseball bats. There’s even a scene at a deli counter where Michelangelo replaces his nunchucks with linked pepperonis, shouting, “Combat coldcuts!” while taking down the bad guys. Most of the fight scenes are similarly lighthearted and energetic, making them fun to watch despite their lack of seriousness.",docs/images/polygon_1_1773522584173.jpg
Polygon,The RAM crisis could completely change the way developers make games,"Sat, 14 Mar 2026 16:00:17 GMT",Giovanni Colantonio,https://www.polygon.com/ram-crisis-gdc-2026-analysis/,"At this year's GDC, industry stress was high due to layoffs, AI anxieties, and global politics. A major focus was the RAM crisis, driven by AI data center demands, causing a 300% price increase and supply shortages. Developers expressed concerns about rising costs affecting personal upgrades and potential impacts on game development and market competition. The crisis may persist for two years.","There were a lot of reasons for developers to be stressed out at this year's Game Developers Conference. Layoffs at EA the day the event started put job insecurity in the air, generative AI's presence at the show sparked existential dread, and the inescapable anxiety of world politics made it hard to focus on creating video games. Those are some heavy topics, and they were only made worse by an economic problem currently plaguing the game development industry: the RAM crisis.

The skyrocketing cost of memory driven by AI was a major topic at this year's GDC. If you didn't bring it up with someone in a conversation, it was because they did first. It was one of the most important narratives of the show, casting a shadow over Xbox's grand Project Helix ambitions and raising questions about how rising prices could impact how games are made. No developer I spoke to quite knew the next steps for navigating the crisis, but several saw it as a moment to finally have a serious conversation about the industry's insatiable hunt to create the most high-end games possible.

On the consumer side, the impact of the memory supply shortage is simple: RAM has gotten more expensive. Earlier this year, PC Gamer shared data showing that the price of RAM has a 300% increase in some cases. Upgrading your PC right now is pricier as a result, but the problem is only snowballing due to how many products ship with a memory component. It’s not your everyday shopper who is having trouble buying RAM, but the companies making the products that use it too.

What’s the problem? In very simplified terms, AI data centers require a lot of memory. There are only a handful of major memory manufacturers (Samsung and Micron, for instance) making those products, and they can make a lot more money if they sell specialized parts to AI companies rather than consumers. With more chips spoken for, low supply has led to higher costs for the rest of us. You’d think that the easy solution would be “just produce more chips,” but that’s easier said than done for a variety of factors, including the fact that RAM requires a lot of rare metals to produce. It’s also not as simple as spinning up some competing manufacturers, as that would take years. We’re at a dead end, and developers at GDC told me that we might be there for another two years.

The developers I spoke to were split on just how much that would impact game development directly. Some said that they were annoyed that it was more expensive to upgrade their own personal PCs, but that they didn’t feel it was having a knock-on effect for creating their games. Others in the space noted some tangential side effects.

“It does wind up in our conversations particularly when we’re looking at the competition,” one marketing professional told me. “If you’re asking people to suddenly pay more for their systems, that’s fewer games than they can purchase. So it does change some of the conversations around how we have to adapt.”",docs/images/polygon_2_1773522593473.jpg
Polygon,Invincible's showrunners reveal the brutal truth about 'superhero fatigue',"Sat, 14 Mar 2026 15:30:17 GMT",Jake Kleinman,https://www.polygon.com/invincible-season-4-showrunners-superhero-fatigue/,"Superhero movies and TV shows are experiencing a decline in cultural dominance, with audiences now expecting higher quality and innovation. Creators like Robert Kirkman of Invincible emphasize the need for the genre to evolve and stand out amid fierce competition from a vast array of existing content across streaming platforms. Success now requires originality and exceptional execution.","Superhero movies aren’t the cultural phenomenon they once were, with both Hollywood executives and fans sensing a decline in their dominance. Marvel’s once-unmatched cultural influence and even mediocre DC films could still perform well at the box office, but the returns on comic-book-based action films are diminishing. Television has faced similar challenges; for example, reactions to Wonder Man contrast sharply with WandaVision, which earned a sequel despite mixed reviews.

Are onscreen superheroes past their prime? Not according to the showrunners of Invincible, which returns for its fourth season on Prime Video on March 18. Franchise creator Robert Kirkman told Polygon that the superhero obsession remains, but audiences have become more savvy and accustomed to the genre. The issue isn’t boredom but the need for the genre to evolve. Being merely competent is no longer enough, as audiences have grown accustomed to the storytelling style since Marvel movies began releasing multiple films annually.

Kirkman emphasized that superhero stories need to elevate the genre to meet heightened audience expectations. His co-showrunner, Simon Racioppa, agreed, noting that the bar for these films remains high and that the genre’s success has raised expectations for each new release. To stand out, creators must offer something unique or execute exceptionally well across all aspects.

The challenge extends beyond superheroes to the broader media landscape. When the Marvel Cinematic Universe launched with Iron Man in 2008, streaming services like Netflix were just emerging. Today, each new movie or show competes not just with other recent releases but with every piece of content ever produced. Kirkman pointed out that on streaming platforms, a show is often competing with classics like Friends or Seinfeld, making it harder to break through.

He concluded that creators must find ways to be distinctive and capture viewers’ attention in a crowded, scrolling world, whether making superhero content or other genres.",docs/images/polygon_3_1773522600848.jpg
Film Jabber,Reminders of Him,2026-03-14,Unknown,http://www.filmjabber.com/movie-preview/reminders-of-him.html,"""Reminders of Him"" (2026) is a PG-13 romance drama directed by Vanessa Caswill, set for release on March 13, 2026. Based on Colleen Hoover's novel, it stars Maika Monroe and others, and explores themes of motherhood, forgiveness, and love after a woman, Kenna, spends seven years in prison following a tragic mistake.","Reminders of Him (2026) is a romance drama rated PG-13 with a runtime of 114 minutes. It is set to be released on March 13, 2026, directed by Vanessa Caswill and written by Colleen Hoover and Lauren Levine. The cast includes Maika Monroe, Tyriq Withers, Rudy Pankow, Lainey Wilson, Lauren Graham, and Bradley Whitford. The film is produced by Universal Pictures.

What is Reminders of Him about? There was before you and there was during you. For some reason, I never thought there would be an after you. The literary phenomenon from #1 New York Times bestselling author Colleen Hoover becomes a transformative feature film about motherhood, forgiveness, and the power of love to overcome even the worst mistake.

After a perfect outing with her boyfriend, Kenna (Maika Monroe) makes an unbearable mistake that sends her to prison. Seven years later,...

[Full synopsis and reviews omitted for brevity.]",docs/images/filmjabber_1_1773522608621.webp
Variety,"Jamie Lee Curtis Likely Would Have Passed on Jason Blum’s ‘Halloween’ Sequel If She Knew It Was a Trilogy. So, She Used It to Get a Development Deal","Sat, 14 Mar 2026 20:59:37 +0000",Emily Longeretta,https://variety.com/2026/film/news/jamie-lee-curtis-halloween-trilogy-1236688041/,"Jamie Lee Curtis discussed her surprise extension of her “Halloween” role, initially expecting only one film. She credited Jason Blum for reviving the franchise and used her deal to secure funding for other projects. Curtis also highlighted her producing work, including “The Lost Bus,” and noted her mixed feelings about the horror genre despite her iconic status.","Jamie Lee Curtis didn’t know she was about to take on three more “Halloween” movies when she said yes to David Gordon Green’s 2018 film, the sequel to her 1978 film. During a SXSW panel titled, “If Not Now, When, if Not Me, Who? Pivoting and Manifesting,” Curtis opened up about filmmaking and her career as an actress and producer. She first named her appreciation for Jason Blum.

“The only reason I am sitting in this chair today is because of Jason. Jason Blum, who runs Blumhouse, is the one who brought back the ‘Halloween’ movies,” she said. However, when she got the call, she thought it was one movie and didn’t hear until way later that they were planning to do more.

“If they had come to me and said it’s going to be a trilogy, I don’t think I would have said yes,” she said. “Jason Blum is notoriously cheap. How do you make low-budget movies? You don’t pay people. That’s the model.” 

So, she used it to her advantage. “While we were editing and doing the mix, David said, ‘You know it’s a trilogy.’ I was like, ‘Uh, no.’ I went to Jason Blum and said, ‘I have some ideas, maybe you could give me a first look deal, just pay me a little money,’” she recalls. “I said to Jason, ‘How about a little development deal?’ And I owed him two ‘Halloween’ movies, so what was he gonna say?”

Curtis wanted the extra money to pay Russell Goldman, a filmmaker who was working with her to try and get “Mother Nature” made. Goldman now works in development for Curtis’s Comet Pictures, and he’s making his directorial feature debut at SXSW with “Sender.” The premiere will be the first time Curtis ever saw the Comet Pictures logo on the big screen.

“Jason Blum gave me a vanity deal,” she says, referencing an earlier moment of the conversation where they discussed how every actor takes the producer credit differently. She added that Blum likely never expected she’d then call him for multiple projects. For example, Curtis heard an NPR story about a school bus driver and teacher who saved 22 children and said she wanted to produce it. This year, the Apple TV film “The Lost Bus” is nominated at the Oscars for Best Visual Effects.

Later in the conversation, the moderator brought up that the Academy is finally respecting the horror genre with the massive amount of love for “Sinners.” Curtis noted that although she’s a Scream Queen, she doesn’t love the genre.",docs/images/variety_2_1773522632136.jpg
Variety,"FCC Chairman Brendan Carr Says TV Broadcasters Must ‘Correct Course’ or ‘They Will Lose Their Licenses,’ Citing Trump’s Outrage Over Iran War Coverage","Sat, 14 Mar 2026 20:45:07 +0000",Jack Dunn,https://variety.com/2026/tv/news/brendan-carr-broadcast-licenses-iran-war-donald-trump-fcc-1236688078/,"FCC Chairman Brendan Carr warned broadcasters to ""correct course"" or risk losing licenses over alleged misinformation, citing Trump’s criticism of media coverage on Iran. Carr linked to Trump’s social media post condemning headlines about U.S. tanker planes. While lacking authority over newspapers, Carr appears to target TV broadcasters, emphasizing regulation of political content and media influence.","FCC Chairman Brendan Carr wrote on X Saturday that broadcasters need to “correct course” or risk losing their broadcasting licenses, citing Donald Trump’s recent displeasure with the mainstream media’s coverage of the Iran War. “Broadcasters that are running hoaxes and news distortions – also known as the fake news – have a chance now to correct course before their license renewals come up,” Carr wrote. “The law is clear. Broadcasters must operate in the public interest, and they will lose their licenses if they do not.”

Carr linked to a Truth Social post from Trump, in which the president condemned “intentionally misleading headlines” about U.S. tanker planes that were targeted in Saudi Arabia. Trump claimed the planes were not “’struck’ or ‘destroyed’” and that four of the five planes involved in the attack were “already back in service.” Trump went on to call out “lowlife ‘papers’” like the New York Times and the Wall Street Journal, who “want us to lose the War.”

It is important to note that the FCC chairman has no authority over papers like the WSJ or NYT. However, Carr, who has been outspoken about quieting unfavorable TV coverage of the Trump administration, appears to be sending out a warning to broadcasters in a preemptive attempt to influence their reporting.

Carr has yet to take action against any major news organizations during his tenure under Trump. Instead, his biggest impact has been in the talk show and late-night TV space. In February, Carr appeared on Fox News’ “The Ingraham Angle” and confirmed that the FCC had begun enforcement proceedings regarding alleged violations of the equal time rule involving political candidates by ABC’s “The View.” “The days that these legacy media broadcasters get to decide what we can say, what we can think, who we can vote for are over,” Carr stated during the interview.",docs/images/variety_4_1773522639749.jpg
Variety,"Phil Campbell, Motörhead Guitarist, Dead at 64","Sat, 14 Mar 2026 18:45:54 +0000",Payton Turkeltaub,https://variety.com/2026/music/news/phil-campbell-dead-motorhead-1236688004/,"Phil Campbell, guitarist for Motörhead for 31 years, died at 64 following intensive care after surgery. He was also known for his solo album and founding Phil Campbell and the Bastard Sons with his sons. His bandmates and family expressed condolences, highlighting his musical talent, humor, and love of life.","Phil Campbell, the guitarist for the rock band Motörhead, died on Friday following a battle in intensive care after a major operation. He was 64. His death was confirmed in a statement posted to the Phil Campbell and the Bastard Sons Instagram account.

“It is with great sadness that we announce the passing of our beloved father, Philip Anthony Campbell, who passed away peacefully last night,” the statement read. “Phil was a devoted husband, a wonderful father, and a proud and loving grandfather, known affectionately as ‘Bampi.’ He was deeply loved by all who knew him and will be missed immensely. His legacy, music, and the memories he created with so many will live on forever. We kindly ask that our family’s privacy is respected during this incredibly difficult time.”

Campbell was the guitarist for Motörhead for 31 years. He first joined the band in 1984 and remained until its disbandment after vocalist and bassist Lemmy died in 2015. After Motörhead, he released his solo album, “Old Lions Still Roar,” in 2019, and founded Phil Campbell and the Bastard Sons with his three sons, Todd, Dane, and Tyla Campbell. The band released its first album, “The Age of Absurdity,” in 2018, and most recently released “Kings of the Asylum” in 2023.

“Phil was a wonderful guitarist, writer, performer, and musician who had Motörhead in his veins. He always led with his gift of guitar, and carried a great sense of humour, but most of all, Phil led with his heart. You could not be around him without a chuckle or twenty, because quite simply, Phil loved life and lived it with great joy,” wrote a statement posted to the Motörhead Instagram account.

The post added, “There will be plenty of time for us to share stories, tales of Campbell glory and some damn good jokes together; for now, please send love and positive energy to Gaynor and the boys while affording them time, space, and privacy.”",docs/images/variety_6_1773522647700.jpg
Ars Technica,Staff complain that xAI is flailing because of constant upheaval,"Sat, 14 Mar 2026 07:14:53 +0000","Stephen Morris and Cristina Criddle, Financial Times",https://arstechnica.com/ai/2026/03/staff-complain-that-xai-is-flailing-because-of-constant-upheaval/,"Elon Musk ordered layoffs at x AI due to poor performance of its coding products, leading to the departure of two cofounders and restructuring efforts. The company, struggling to compete with Anthropic and OpenAI, is being rebuilt from scratch. Musk aims for a major stock listing and ambitious AI projects, including space-based data centers and Mars colonization.","Elon Musk has ordered another round of job cuts at x AI after growing frustrated with the poor performance of its coding product, forcing out several more cofounders and bringing in “fixers” from SpaceX and Tesla to audit the startup. The latest overhaul of the two-year-old company follows the success of Anthropic and OpenAI, whose AI coding tools have significantly impacted the software industry.

Musk has increased pressure after merging SpaceX with x AI in a $1.25 billion deal, as he aims to meet a June deadline for what could be the largest stock market listing in history. His broader goals include launching AI data centers into space, building factories on the Moon, and colonizing Mars.

Despite Musk’s push, x AI’s Grok chatbot and coding product have struggled to attract paying users or businesses. Musk stated on X that “x AI was not built right first time around, so is being rebuilt from the foundations up,” comparing the process to Tesla’s early days. SpaceX and Musk did not immediately comment.

Managers from SpaceX and Tesla have been reviewing x AI employees’ work, resulting in some firings due to perceived inadequacies. A key focus has been the quality of training data, which has contributed to the lag of its coding product behind competitors like Anthropic’s Claude Code and OpenAI’s Codex.

The review has led to the departure of two cofounders: Zihang Dai, a senior technical staff member who publicly acknowledged x AI’s coding delays, and Guodong Zhang, who managed pre-training of Grok models and was blamed for issues with the coding product. Zhang confirmed his departure on X.

After these exits, only Manuel Kroiss and Ross Nordeen remain of the original 11 cofounders who helped establish x AI in San Francisco in March 2023. Last month, Musk criticized the coding team for falling behind in a town hall meeting and announced a reorganization that saw the removal of other cofounders, including Greg Yang, Tony Wu, and Jimmy Ba.

Toby Pohlen, a former DeepMind researcher, was appointed to lead the “Macrohard” project aimed at building digital agents capable of replicating entire software companies—a project Musk described as the company’s “most important.” The name was a humorous reference to Microsoft. However, Pohlen left the company just 16 days later, and Musk has since reassigned Ashok Elluswamy, Tesla’s head of AI software, to reboot the Macrohard initiative.",docs/images/ars_technica_1_1773522656824.jpg
