Source,Title,Date,Author,URL,Summary,Content,Image_URLs
Ars Technica,NASA officials sidestepped questions on Artemis II risks—there's a reason why,"Sat, 14 Mar 2026 00:17:31 +0000",Stephen Clark,https://arstechnica.com/space/2026/03/flying-to-the-moon-for-the-first-time-in-54-years-is-risky-but-how-risky/,"NASA officials acknowledged the risks of Artemis II, the first crewed Moon mission since 1972, emphasizing its novelty and limited data from previous tests. The nine-day mission, launching no earlier than April 1, involves new spacecraft and a trajectory far beyond Earth. Despite uncertainties, NASA approved final preparations, highlighting ongoing risk mitigation efforts.","When talking about risk during a press conference on Thursday, the NASA officials in charge of the upcoming Artemis II Moon mission hedged their answers. Reporters’ questions on the risks were certainly valid and appropriate. In an open society, it is vital to set expectations for any hazardous venture such as spaceflight—most importantly for the astronauts actually making the journey, but also for NASA’s workforce, the White House, lawmakers, and members of the public paying for the endeavor.

What’s more, Artemis II will be the first mission since 1972 to fly humans to the vicinity of the Moon. This is not following the well-trodden yet perilous path that astronauts take to reach the International Space Station, just a few hundred miles above Earth. Artemis II will travel more than 1,000 times farther from Earth than the ISS, departing on a trajectory taking the mission several thousand miles beyond the far side of the Moon. The mission will last nine days from liftoff in Florida to splashdown in the Pacific Ocean. The four-person crew will ride a rocket and spacecraft—the Space Launch System and Orion—that have flown together just once before. The sheer novelty of the mission makes it difficult to quantify the risk, NASA officials said Thursday.

With just a single data point from flight testing—the unpiloted Artemis I demo mission in 2022—NASA managers were reluctant to publicize the bottom-line number from the probabilistic risk assessment for Artemis II. Lori Glaze, NASA’s acting associate administrator for exploration system development, said the agency completed an assessment for Artemis II but questioned the exercise’s usefulness. “I think sometimes we get tricked into believing that those numbers are somehow really telling us something critically important,” Glaze said. “I think they’re valuable. I think we can do things in a relative sense to measure what’s more risky or less risky.”

Glaze and other members of the Artemis II management team were speaking with reporters at NASA’s Kennedy Space Center following a flight readiness review. The two-day conclave in Florida provided the forum for a “very open” and “transparent” discussion of NASA’s “risk posture” heading into the Artemis II launch, and “how we’re mitigating those risks,” Glaze said. The decision-makers present for the meeting unanimously agreed to continue final preparations for the Artemis II mission, now scheduled for liftoff no earlier than April 1 at 6:24 pm EDT (22:24 UTC). “It is a test flight, and it is not without risk, but our team and our hardware are ready,” Glaze said. The four astronauts training to fly on Artemis II joined the Flight Readiness Review (FRR) virtually from their home base in Houston. Their participation included discussion of the Orion spacecraft’s heat shield and reentry trajectory.",docs/images/ars_technica_3_1773522665701.jpg
Ars Technica,Woman sneezes out maggots after fly larvae get trapped in her deviated septum,"Fri, 13 Mar 2026 22:38:10 +0000",Beth Mole,https://arstechnica.com/health/2026/03/woman-sneezes-out-maggots-after-fly-larvae-get-trapped-in-her-deviated-septum/,"A Greek woman, aged 58, holds the record for the longest parasitic sheep bot fly in her nose, with larvae progressing to the pupa stage—previously thought impossible in humans. After swarming by flies, she experienced symptoms and expelled larvae, with genetic analysis confirming the species. This case challenges previous beliefs that fly development cannot advance beyond early larval stages in humans.","A 58-year-old woman in Greece appears to hold the record for growing a parasitic sheep bot fly in her nose the longest, almost creating a snot rocket that could literally fly. Usually, when the sheep bot fly accidentally enters a human’s nose, the first-stage larvae they deliver do not develop further. In its normal target—a sheep’s nose—the larvae move into the sinuses, feed, grow, and molt into second- and third-stage larvae. From there, the flies (Oestrus ovis) drip from the nose onto the ground, burrow into the soil, pupate, and emerge as adult flies.

For a long time, experts believed that the flies could not complete their development in humans beyond the first larval stage. However, a few human cases have been reported in recent decades involving second- and third-stage larvae. The woman’s case, reported in the Journal of Emerging Infectious Diseases by a medical entomologist and colleagues, goes the furthest yet, with findings of pupa and a puparium—the hard casing of a pupa—in her nose.

The experts noted that the woman worked outdoors on a Greek island near a field with grazing sheep. On a hot, dry September day, she recalled being swarmed by flies. About a week later, she experienced facial pain and developed a cough over the next two to three weeks. These were her only symptoms until October 15, when she sneezed and reported that “worms” came out of her nose. They were, in fact, late-stage sheep bot fly larvae.

She underwent surgery to remove the mucus and larvae, recovering 10 larvae at various stages and a pupa. Genetic testing and DNA sequencing confirmed they were sheep bot flies, as did visual inspection of two third-stage larvae and the puparium. The third instar larva was yellowish with rows of spines on the ventral surface, and the posterior peritremes were circular with a central button. The broken puparium was black and wrinkled, containing remnants of the pupa.

Not only had experts never found a pupa in a human nose before, but they also believed that development to that stage was “biologically implausible.” They noted that the paranasal sinus environment does not meet the temperature and humidity requirements for pupation, and host secretions and immune responses further inhibit development.",docs/images/ars_technica_6_1773522674060.jpg
